service_code,service_name_display,service_desc,service_code_type,service_tech_name
75574,CT Scan Angiography With Dye - Heart,CT Scan Angiography With Dye - Heart,CPT,CT Scan Angiography With Dye - Heart
75625,Radiological Supervision of Placement of Catheter in Aorta,Radiological Supervision of Placement of Catheter in Aorta,CPT,Radiological Supervision of Placement of Catheter in Aorta
75710,Radiological Supervision of Placement of Catheter in Extremity Artery,Radiological Supervision of Placement of Catheter in Extremity Artery,CPT,Radiological Supervision of Placement of Catheter in Extremity Artery
75952,Radiological Supervision of AAA Repair,Radiological Supervision of AAA Repair,CPT,Radiological Supervision of AAA Repair
76536,Ultrasound of Neck,Ultrasound of Neck,CPT,Ultrasound of Neck
76645,Ultrasound of Breast(s),An ultrasound of the breast(s) uses high-frequency sound waves to create images of breast tissue.,CPT,Ultrasound of the breast(s)
76700,Ultrasound of Abdomen - (Complete),"A complete abdominal ultrasound is an imaging procedure used to examine the internal organs of the abdomen, including the liver, gallbladder, spleen, pancreas, and kidneys. The blood vessels that lead to some of these organs can also be looked at with ultrasound.",CPT,Ultrasound of the abdomen (complete)
76705,Abdominal Ultrasound,A limited abdominal ultrasound is an imaging procedure used to look at single organ or single quadrant in the abdomen; it can also be used to follow up on a previous exam.,CPT,Abdominal Ultrasound
76770,Ultrasound - Retroperitoneal (Rear of Abdomen),"A retroperitoneal ultrasound is an imaging procedure used to examine the internal organs in the rear of the abdomen, including the aorta, lymph nodes, and kidney.  ",CPT,Ultrasound of the rear of the abdomen
76801,Ultrasound of Pregnant Uterus (Before 14 Weeks),An ultrasound of a pregnant uterus before 14 weeks,CPT,Routine OB care - Ultrasound
76805,Ultrasound of Pregnant Uterus (After 14 Weeks),An ultrasound of a pregnant uterus after 14 weeks,CPT,Routine OB care - Ultrasound
76811,Ultrasound of Pregnant Uterus (Detailed Images of Mom and Baby),An obstetric ultrasound is the use of high-frequency sound waves and a handheld probe to create detailed pictures of your uterus and unborn baby.,CPT,Ultrasound of pregnant uterus with detailed pictures of mom and baby
76813,Ultrasound of pregnant uterus (includes measurements for chromosomal abnormalities or heart defects),An ultrasound of a pregnant uterus with detailed measurements of the baby,CPT,Ultrasound of pregnant uterus (includes measurements for chromosomal abnormalities or heart defects)
76815,Ultrasound of Pregnant Uterus (Limited Study),A limited ultrasound of a pregnant uterus,CPT,Ultrasound of pregnant uterus (limited study)
76816,Screening Mammogram - Additional Computer Images,A follow-up ultrasound of a pregnancy uterus,CPT,Ultrasound of pregnant uterus (follow-up study)
76817,Ultrasound of Pregnant Uterus (Via Vagina),An ultrasound of a pregnant uterus using a probe inserted in the vagina,CPT,Ultrasound of Pregnant Uterus (via vagina)
76830,Ultrasound of Pelvis Via Vagina,"A transvaginal ultrasound is a type of pelvic ultrasound that uses sound waves to create detailed images of the reproductive organs (uterus, ovaries, cervix, and vagina) using a probe inserted into the vagina.",CPT,Ultrasound of pelvis (not related to pregnancy) via probe inserted into the vagina
76856,Ultrasound of Pelvis,"An ultrasound of the pelvis uses high-frequency sound waves to create images of organs and systems within the pelvis (not related to pregnancy).

",CPT,Ultrasound of pelvis not related to pregnancy
76870,Ultrasound of Scrotum,Ultrasound of Scotum,CPT,Ultrasound of Scrotum
76872,Ultrasound of Rectum,Ultrasound of Rectum,CPT,Ultrasound of Rectum
76881,Ultrasound of Leg or Arm,Ultrasound of Leg or Arm,CPT,Ultrasound of Leg or Arm
76942,Ultrasound Guidance During Biopsy,The use of ultrasound to guide a biopsy,CPT,Ultrasound Guidance During Biopsy
77012,CT Scan Guidance,CT Scan Guidance,CPT,CT Scan Guidance
77051,Diagnostic Mammogram - Additional Computerized Images,A diagnostic mammogram is when two images of each breast are taken to evaluate breast symptoms; this represents additional computerized images to help identify lesions earlier. ,CPT,Diagnostic Mammogram - Additional Computerized Images
77052,Screening Mammogram - Additional Computer Images,A screening mammogram is when two images of each breast are taken to find breast cancer before it causes symptoms; this represents additional computerized images to help identify lesions earlier. ,CPT,Screening Mammogram (additional computer images)
77056,Diagnostic Mammogram - Film,A diagnostic mammogram is when two images of each breast are reproduced on film to evaluate breast symptoms. ,CPT,Diagnostic Mammogram - Film
77057,Preventive Screening Mammogram - Film,A preventive screening mammogram is when two images of each breast are reproduced on film to find breast cancer before it causes symptoms. ,CPT,Preventive Screening Mammogram - Film
77058,MRI - Breast - Unilateral,MRI - Breast - Unilateral,CPT,MRI - Breast - Unilateral
77059,MRI - Breast - Bilateral,MRI - Breast - Bilateral,CPT,MRI - Breast - Bilateral
77073,Bone Length Study,Bone Length Study,CPT,Bone Length Study
77080,"Bone Density Study - Hips, Pelvis, and Spine",A dual-energy x-ray absorptiometry (DXA) test measures bone density in the lower spine and the hip.,CPT,"Bone Density Study - Hips, Pelvis, and Spine"
77263,Radiation Treatment Planning ,Radiation Treatment Planning ,CPT,Radiation Treatment Planning 
77290,Radiation Treatment Simulation - Complex,Radiation Treatment Simulation - Complex,CPT,Radiation Treatment Simulation - Complex
77300,Radiation Treatment Dose Calculation,Radiation Treatment Dose Calculation,CPT,Radiation Treatment Dose Calculation
77301,Radiation Treatment Planning - Varied Intensity,Semi-Private Room and Board - Medical or Surgical,CPT,Radiation Treatment Planning - Varied Intensity
77334,Radiation Treatment Devices - Complex,Radiation Treatment Devices - Complex,CPT,Radiation Treatment Devices - Complex
77336,Radiation Consultation ,Radiation Consultation,CPT,Radiation Consultation
77338,Device Building for Varied Intensity Treatment,Device Building for Varied Intensity Treatment,CPT,Device Building for Varied Intensity Treatment
77413,Radiation Treatment Delivery - Low Intensity,Radiation treatment is the use of radiation to kill cancer cells in a specific area of the body.,CPT,Radiation Treatment Delivery - Low Intensity
77414,Radiation Treatment Delivery - Medium Intensity,Radiation treatment is the use of radiation to kill cancer cells in a specific area of the body.,CPT,Radiation Treatment Delivery - Medium Intensity
77418,Radiation Treatment Delivery - Varied Intensity,Radiation treatment is the use of radiation to kill cancer cells in a specific area of the body.,CPT,Radiation Treatment Delivery - Varied Intensity
77427,Radiation Treatment Management,Radiation Treatment Management,CPT,Radiation Treatment Management
78070,Images of Parathyroid Gland,Images of Parathyroid Gland,CPT,Images of Parathyroid Gland
78227,HIDA Scan,HIDA Scan,CPT,HIDA Scan
78452,Heart SPECT Imaging Studies,A myocardial perfusioin imaging test is used to determine if there is a problem with the blood flow to the heart muscle and if there has been a previous heart attack.,CPT,Myocardial Perfusion Imaging Test (Multiple views)
78815,PET Scan with CT Scan,A positron emission tomography (PET) scan is an imaging test that uses a radioactive substance to see how well the organs in the body are working.  It is performed with a CT scan.  ,CPT,Positron Emission Tomography (PET) scan with CT scan - Skull to Thigh
80048,Basic Metabolic Panel Test,"A basic metabolic panel is a group of chemical tests that include measures of kidney function (BUN/Creatinine), blood sugar, and various electrolytes (sodium, potassium, and chlorine).",CPT,Basic Metabolic Panel (Chem 7)
80050,General Health Panel Test,"A routine group of lab tests that provides detailed information on your overall health; it includes a Comprehensive Metabolic Panel (Chem 20), a Complete Blood Count (CBC), and a Thyroid Stimulating Hormone (TSH) level.",CPT,General Health Panel
80053,Comprehensive Metabolic Panel Test,"A comprehensive metabolic panel is a group of chemical tests that include total cholesterol, total protein, and various electrolytes (sodium, potassium, chlorine, and many others). The rest of the tests measure chemicals that reflect liver and kidney function.",CPT,Comprehensive Metabolic Panel (Chem 20)
80055,New Pregnant Patient Lab Test,Obstetric Panel,CPT,Routine OB care - Labwork
80061,Cholesterol Test,A lipid panel test is a rough measure of all the cholesterol and triglycerides in your blood. ,CPT,Lipid Panel Test
80076,Liver Panel Test,"A group of lab tests that provide detailed information on your liver; it documents the level of Albumin, Bilirubin, Phosphate, Protein, and Transferase in your blood.  ",CPT,Hepatic Function Panel
81000,Urine Test - Manual,"This test checks for abnormal levels of substances in the urine, such as bacteria, blood, and protein. ",CPT,Urinalysis; non-automated with microscopy 
81002,Urine Test - Dip Stick,A urinalysis is the physical and chemical examination of urine.,CPT,"Urinalysis, by dip stick or tablet reagent "
81003,Urine Test - Automated,"A urinalysis is the physical, chemical, and occasionally microscopic examination of urine.",CPT,Urinalysis; automated without microscopy 
81025,Urine Pregnancy Test,A test that measures the level of human chorionic gonadotropin hormone (HCG) in the urine. ,CPT,Routine OB care - Labwork
82043,Urine Microalbumin Test,This test checks for small quantities of albumin (a protein) in your urine.,CPT,Urine Microalbumin Test
82105,AFP Test,Alpha-Fetoprotein (AFP) Blood Test for birth defects,CPT,Routine OB care - Labwork
82270,Blood in Stool Test,This test checks to see if there is any hidden blood in the stool (feces).,CPT,Stool Guaiac Test
82306,Vitamin D Test,A Vitamin D blood test measures the level of Vitamin D in your blood.,CPT,Vitamin D level
82360,Analysis of Urine Stone (Calculus),The analysis of a stone from the urinary tract.,CPT,Analysis of Urine Stone (Calculus)
82378,Carcinoembryonic Antigen - CEA,Carcinoembryonic Antigen - CEA,CPT,Carcinoembryonic Antigen - CEA
82550,Creatine Kinase Test,Creatine Kinase Test,CPT,Creatine Kinase Test
82565,Creatinine Test,This test checks the level of creatinine in your blood. ,CPT,Creatinine
82670,Estradiol Test,Estradiol Test,CPT,Estradiol Test
82947,Fasting Blood Glucose Test,A test that measures the level of glucose (sugar) in the blood. ,CPT,Blood Glucose Level
82950,Glucose Test,Blood sugar test,CPT,Routine OB care - Labwork
82977,Liver Enzyme Study - GGT,Gamma Glutamyltransferase (GGT),CPT,Gamma Glutamyltransferase (GGT)
83036,Hemoglobin A1c Test,A hemoglobin A1C test shows what your average blood sugar levels have been over the past few months. It can also tell you if your diabetes treatment plan is working.,CPT,Hemoglobin A1c Test
83615,Lactate Dehydrogenase - LDH Test,This test checks the level of lactate dehydrogenase (LDH) in your blood. ,CPT,Lactate Dehydrogenase (LDH)
83690,Lipase Test,This test checks the level of lipase in your blood. ,CPT,Lipase Test
84153,Prostate-Specific Antigen - PSA Test,A blood test to screen for prostate cancer or to monitor the course of the disease.,CPT,Prostate Specific Antigen (PSA)
84439,Thyroxine - T4 Test,"A test that checks the level of thyroxine (T4), a hormone made by the thyroid gland, in your blood. ",CPT,Thyroxine (T4)
84443,Thyroid-Stimulating Hormone - TSH Test,This test checks the level of thyroid-stimulating hormone (TSH) in your blood. ,CPT,Thyroid Stimulating Hormone (TSH)
84479,Thyroid Hormone Test,This test checks the blood levels of a protein that carries the thyroid hormone in your blood.,CPT,Thyroid Hormone Uptake
84550,Uric Acid Test,This test checks the amount of uric acid in your blood. ,CPT,Uric Acide
84702, Pregnancy Blood Test,Chorionic Gonadotropin T (HCG-Pregnancy Test),CPT,Routine OB care - Labwork
84703, Pregnancy Test - Blood or Urine,Chorionic Gonadotropin T (HCG-Pregnancy Test) Blood or Urine,CPT, Pregnancy Test - Blood or Urine
85014,Hematocrit Test,This test checks the red blood cells in your blood. ,CPT,Hematocrit
85018,Hemoglobin Test,This test checks the amount of hemoglobin (a protein that carries oxygen) in your blood. ,CPT,Hemoglobing  
85025,Complete Blood Count - CBC Test,"A complete blood count (CBC) test measures red blood cells (RBCs), white blood cells (WBCs), hemoglobin, hematocrit, platelets, and the size and hemoglobin content of the red blood cells.",CPT,Complete Blood Count (CBC)
85060,Blood Smear Interpretation,Blood Smear Interpretation,CPT,Blood Smear Interpretation
85097,Bone Marrow Smear Interpretation,Bone Marrow Smear Interpretation,CPT,Bone Marrow Smear Interpretation
85610,PT Blood Test,This test checks the time it will take for your blood to clot. ,CPT,Prothrombin Time ((PT)
85651,Sed Rate - ESR Test,This measures how fast red blood cells fall to the bottom of a glass tube; the faster the cells fall the more inflammation is presesnt in the body.,CPT,Sedimentation Rate (ESR)
85652,Sed Rate - ESR Test - Automated,This measures how fast red blood cells fall to the bottom of a glass tube; the faster the cells fall the more inflammation is presesnt in the body.,CPT,Sed Rate - ESR Test - Automated
85730,PTT Blood Test,This test checks the time it will take for your blood to clot when you are receiving Heparin therapy. ,CPT,Partial Thromboplastin Time (PTT)
86140,C-Reactive Protein - CRP Test,This test is done to check the level of C-reactive protein (CRP) in your blood. CRP is a marker of inflammation somewhere in the body. ,CPT,C-Reactive Protein (CRP)
86300,Tumor Antigen Analysis,Tumor analysis for antigens,CPT,Tumor Antigen Analysis
86308,Mono Test,This test is done to see if you have mononucleosis.,CPT,Monospot
86431,Rheumatoid factor,Rheumatoid factor,CPT,Rheumatoid factor
86580,Tubercolosis - TB Test,Tubercolosis - TB Test,CPT,Tubercolosis - TB Test
86592,Syphilis Testing,"A test to determine if you have syphilis, a sexually transmitted disease. ",CPT,Syphilis Testing
86618,Lyme Disease Antibody Test ,Lyme Disease Antibody Test ,CPT,Lyme Disease Antibody Test 
86677,Helicobacter Pylori Test,"A test to determine the presence of Helicobacter Pylori, a common cause of stomach problems.",CPT,Helicobacter pylori
86703,HIV Test,HIV-1/HIV-2 Single Assay,CPT,Routine OB care - Labwork
86707,Hepatitis Be Antibody ,Hepatitis Be Antibody ,CPT,Hepatitis Be Antibody 
86850,Antibody Screening Blood Test,Antibody screening (RBC),CPT,Antibody Screening Blood Test
86900,ABO Blood Typing Test,Blood Typing (ABO),CPT,ABO Blood Typing Test
86901,RH Blood Typing Test,Blood Typing (RH),CPT,RH Blood Typing Test
87070,Bacterial Culture - Other Source Test,"A test to check for bacteria in a body fluid or discharge, typically due to an infection.  ",CPT,Body fluid or discharge culture for bacteria
87081,Screening Culture Test,This test checks for the presence of bacteria in a body fluid. ,CPT,Routine OB care - Labwork
87086,Bacterial Culture - Urine Test,"A test to check for bacteria in the urine, typically due to a urinary tract infection.  ",CPT,Urine culture for bacteria
87340,Hepatitis B Surface Antigen Test,Hepatitis B Surface Antigen Test,CPT,Hepatitis B Surface Antigen Test
87350,Hepatitis B Antibody Test,Hepatitis B Antibody Test,CPT,Hepatitis B Antibody Test
87491,Chlamydia Test,Chlamydia Test,CPT,Chlamydia Test
87517,Hepatitis B Antibody Test,Hepatitis B Antibody Test,CPT,Hepatitis B Antibody Test
87591,Gonorrhea Test,"A test that checks for the presence of a specific bacteria, Neisseria gonorrhoeae, in the mouth, vagina, penis, or anus.  ",CPT,Gonorrhea Culture
87621,Human Papillomavirus - HPV Test,"A test that checks for the presence of a specific virus, human papillomavirus (HPV), in the vagina, penis, or anus.  ",CPT,Human Papilloma Virus (HPV) Culture
87804,Influenza Test,This test checks for the presence of the influenza virus.  ,CPT,Influenza   
87880,Strep Throat Test,"This test checks for the presence of a specific bacteria, Group A Streptococcus, in the throat (Strep Throat) ",CPT,Strep Throat (Group A Strep)
88112,Cytopathology,Cytopathology,CPT,Cytopathology
88141,Pap Smear Test - Cytopathology,Pap Smear Test - Cytopathology,CPT,Pap Smear Test - Cytopathology
88142,Pap Smear Test - Pregnancy,Pap Smear Test,CPT,Routine OB care - Labwork
88173,Evaluation of Specimen - Cytopathology,Evaluation of Specimen - Cytopathology,CPT,Evaluation of Specimen - Cytopathology
88175,Pap Smear Test,Pap Smear Test,CPT,Pap Smear Test
88189,Flow Cytometry Interpretation,Flow Cytometry Interpretation,CPT,Flow Cytometry Interpretation
88304,Pathology Test - Level 3,"The gross and microscopic examination of tissue by a pathologist 
(Level III).",CPT,Tissue examination by pathologist (Level III)
88305,Pathology Test - Level 4,The gross and microscopic examination of tissue by a pathologist (Level IV).,CPT,Tissue examination by pathologist (Level IV)
88307,Pathology Test - Level 5,The gross and microscopic examination of tissue by a pathologist (Level V).,CPT,Tissue examination by pathologist (Level V)
88309,Pathology Test - Level 6,The gross and microscopic examination of tissue by a pathologist (Level VI).,CPT,Tissue examination by pathologist (Level VI)
88311,Tissue Decalcification,Tissue Decalcification,CPT,Tissue Decalcification
88313,Special Stain Exam,Special Stain Exam,CPT,Special Stain Exam
88331,Pathology Consultation During Surgery,A pathology consultation during surgery.,CPT,Pathology Consultation During Surgery
88360,Tumor Antibody Analysis ,Tumor analysis for antibodies,CPT,Tumor Antibody Analysis 
84402,Immunization Administration ,The administration of a vaccine. ,CPT,Immunization Administration 
84403,Free Testosterone Test,Free Testosterone Test,CPT,Free Testosterone Test
90471,Total Testosterone Test,Total Testosterone Test,CPT,Total Testosterone Test
90472,Immunization Administration (Additional Vaccines),The administration of additional vaccine(s).,CPT,Immunization Administration (additional vaccines)
90632,Hepatitis A Vaccine - Adult,The administration of the hepatitis A vaccine to an adult,CPT,Hepatitis A Vaccine - Adult
90633,Hepatitis A Vaccine - Child,The administration of the hepatitis A vaccine to a child,CPT,Hepatitis A Vaccine - Child
90634,Hepatitis A vaccine (3 Dose),The administration of the hepatitis A vaccine (3 dose schedule),CPT,Hepatitis A vaccine (3 dose)
90636,Hepatitis A and B Vaccine,The administration of the hepatitis A and B vaccine.,CPT,Hepatitis A and B vaccine
90645,Hemophilus Influenza (Hib) Vaccine,The administration of the Hemophilus influenza (Hib) vaccine,CPT,Hemophilus influenza (Hib) vaccine
90648,Haemophilus Influenza B  (Hib) Vaccine,The administration of the Hemophilus influenza (Hib) vaccine,CPT,Haemophilus Influenza B  (Hib) Vaccine
90649,Human Papilloma Virus (HPV) Vaccine,The administration of the human papilloma virus (HPV) vaccine,CPT,Human Papilloma Virus (HPV) vaccine
90658,Influenza Vaccine,The adminstration of the influenza vaccine,CPT,Influenza Vaccine
90669,Pneumoccal Vaccine (7 valent),The adminstration of the Pneumoccal vaccine (7 valent),CPT,Pneumoccal vaccine (7 valent)
90670,Pneumoccal Vaccine (13 valent),The adminstration of the Pneumoccal vaccine (13 valent),CPT,Pneumoccal vaccine (13 valent)
90680,Rotavirus Vaccine,The administration of the rotavirus vaccine with 3 doses,CPT,Rotavirus Vaccine
90698,"Diphtheria, Tetanus Toxoids, Acellular Pertussis Vaccine, Haemophilus Influenza Type B, and Poliovirus Vaccine, Inactivated (DTaP - Hib - IPV)","The administration of the Diphtheria, tetanus toxoids, acellular pertussis vaccine, haemophilus influenza Type B, and poliovirus vaccine, inactivated (DTaP - Hib - IPV)",CPT,"Diphtheria, tetanus toxoids, acellular pertussis vaccine, haemophilus influenza Type B, and poliovirus vaccine, inactivated (DTaP - Hib - IPV)"
90700,"Tetanus, Diphtheria, and Pertusis (Tdap) Vaccine","The administration of the Tdap (Tetanus, Diptheria, and Pertusis) vaccine. ",CPT,"Tetanus, Diphtheria, and Pertusis (Tdap) Vaccine"
90707,"Measles, Mumps, and Rubella (MMR) Vaccine","The administration of the MMR (Measles, mumps, and rubella) vaccine.",CPT,"Measles, Mumps, and Rubella (MMR) Vaccine"
90712,Poliovirus Vaccine - OPV (Oral),The administration of the poliovirus vaccine orally,CPT,Poliovirus vaccine - OPV (oral)
90713,Polio Vaccine,The administration of the poliovirus vaccine by an injection,CPT,Polio Vaccine
90714,"Tetanus, diphtheria vaccine","The administration of the Td (Tetanus, Diptheria) vaccine. ",CPT,"Tetanus, diphtheria vaccine"
90715,"Tetanus, Diphtheria, and Pertusis (Tdap) Vaccine","The administration of the Tdap (Tetanus, Diptheria, and Pertusis) vaccine. ",CPT,"Tetanus, diphtheria, and pertusis (Tdap) vaccine"
90716,Chickenpox Vaccine,The administration of the varicella (Chickenpox) vaccine,CPT,Chickenpox Vaccine
90732,Pneumococcal Vaccine,The administration of the pneumococcal vaccine,CPT,Pneumococcal vaccine
90733,Meningococcal  Vaccine,The administration of the meningococcal  vaccine.,CPT,Meningococcal  vaccine
90734,Meningococcal  Vaccine,The administration of the meningococcal  vaccine.,CPT,Meningococcal  vaccine
90736,Shingles vaccine,Herpes Zoster (Shingles) vaccine,CPT,Shingles vaccine
90744,Hepatitis B Vaccine - Child,The administration of the Hepatitis B vaccine to a child,CPT,Hepatitis B Vaccine - Child
90746,Hepatitis B Vaccine - Adult,The administration of the Hepatitis B vaccine to an adult,CPT,Hepatitis B Vaccine - Adult
90791,Initial Psychotherapy Interview,An initial examination with a mental health professional,CPT,Initial Psychotherapy Interview
90792,Initial Psychotherapy Interview with Medical Evaluation,An initial psychological and medical examination with a mental health professional,CPT,Initial Psychotherapy Interview with Medical Evaluation
90834,Individual Psychotherapy,An appointment with a mental health professional for psychotherapy,CPT,Individual Psychotherapy
92012,Intermediate Eye and Medical Exam,An appointment with an eye doctor for an intermediate eye exam and general medical evaluation.,CPT,Intermediate Eye and Medical Exam
92014,Comprehensive Eye and Medical Exam,An appointment with an eye doctor for a comprehensive eye exam and general medical evaluation.,CPT,Comprehensive Eye and Medical Exam
92015,Determination of Refractive State,Measurement of refractive state for eye glass prescription,CPT,Determination of Refractive State
92020,Eye Exam for Glaucoma,Eye Exam for Glaucoma,CPT,Eye Exam for Glaucoma
92083,Visual Field Examination,Visual Field Examination,CPT,Visual Field Examination
92133,Optic Nerve Scanning,Optic Nerve Scanning,CPT,Optic Nerve Scanning
92136,Lens Implant Calculation ,Measurement of opththalmic biometry for intraocular lens calculation,CPT,Lens Implant Calculation
92225,Initial Opthalmoscopy - Extended,Initial extended opthalmoscopy exam.,CPT,Initial Opthalmoscopy - Extended
92226,Subsequent Opthalmoscopy - Extended,Follow up extended opthalmoscopy exam.,CPT,Subsequent Opthalmoscopy - Extended
92551,Hearing Screening Test,The administration of a Hearing Screening Test,CPT,Hearing Screening Test
92557,Comprehensive Hearing Evaluation,Comprehensive Hearing Evaluation,CPT,Comprehensive Hearing Evaluation
92567,Tympanometry - Eardrum Resistance,A measurement of the eardrum's resistance to sound transmission in response to changes in pressure in the outer ear canal. ,CPT,Tympanometry - Eardrum Resistance
92920,Coronary Angioplasty,The placement of a small flexible tube with an inflatable balloon to open an obstructed heart artery.,CPT,Coronary Angioplasty
92928,Placement of Stent,The placement of a stent after a coronary angioplasty,CPT,Placement of Stent
93000,Electrocardiogram - EKG,An electrocardiogram (EKG or ECG) is a recording of the electrical activity within the heart.,CPT,"Electrocardiogram, Complete"
93010,Electrocardiogram Physician Interpretation and Report Only,An electrocardiogram (EKG or ECG) is a recording of the electrical activity within the heart.  This code is just for the physician interpretation and report. ,CPT,Electrocardiogram Report
93015,Heart Stress Test,A stress test can show how your heart responds to exercise; this can help diagnose problems with your heart and coronary arteries.,CPT,Cardiovascular Stress Test
93280,Testing of Heart Pacemaker,Testing of Heart Pacemaker,CPT,Testing of Heart Pacemaker
93283,Testing of Heart Defibrillator,Testing of Heart Defibrillator,CPT,Testing of Heart Defibrillator
93303,Heart Ultrasound for Birth Defects,An echocardiogram is the use of ultrasound (sound waves) to create images and evaluate birth defects of the heart. ,CPT,Transthoracic Echocardiography (for congenital abnormalities)
93306,Heart Ultrasound With Blood Flow Study,An echocardiogram with doppler is the use of ultrasound (sound waves) to create images of the heart and a doppler ultrasound to measure the hearts blood flow and motion.,CPT,"Transthoracic Echocardiography with Doppler
"
93312,Transesophageal Echocardiography,Transthoracic Echocardiography,CPT,Transthoracic Echocardiography
93320,Doppler Echo Exam of the Heart (Additional Test),A test that uses sound waves called Doppler ultrasound to create images of blood flow through the heart,CPT,Complete Electrocardiogram
93325,Doppler Color Flow (Additional Test),A test that uses sound waves called Doppler ultrasound to create color images of blood flow through the heart,CPT,Doppler Color Flow (Additional Test)
